{
  "signal_id": "signal-neuroplasticity-001",
  "monitor_id": "monitor-neuroplasticity-001",
  "participant_id": "avot-neuroplasticity",
  "observed_at": "2026-08-22T17:00:00Z",
  "source_type": "peer_reviewed_literature",
  "source_refs": ["evidence:research-item-001"],
  "subject": "Music-based neuroplasticity finding",
  "summary": "A material research finding warrants institutional review against the harmonic neuroplasticity hypothesis.",
  "novelty_score": 0.82,
  "confidence": 0.88,
  "material_change": true,
  "related_objectives": ["harmonic-neuroplasticity-research"],
  "related_repositories": ["Tyme-Lab"],
  "related_notion_surfaces": ["CIT PILOT 01 — AVOT Monitor Council / Participation Runtime v0"],
  "contradicts_prior_assumption": false,
  "contradiction_refs": [],
  "institutional_significance": "Potentially changes the evidence basis for an existing research hypothesis.",
  "recommended_receiver": "Knowledge Curator",
  "recommended_disposition": "research_review",
  "authority_posture": "analysis_only",
  "institutional_effect": "none",
  "evidence_refs": ["evidence:research-item-001"]
}
